{
  "schema_version": "1.0.0",
  "manifest_hash": "368a6f31629a389ee0a72dd6d746708d3a2383ffb76a574f69315297c2502784",
  "signed_payload": {
    "dataset_id": "calibration-20260713-001",
    "purpose": "CALIBRATION_3D",
    "source_project": "aiq-calibration",
    "source_environment": "shadow",
    "runtime_state": "SHADOW",
    "market_source": "BINANCE_PRODUCTION_PUBLIC",
    "preregistration": {
      "dataset_plan_hash": "59002c5b6c7bcbedcae0daf758ec65addc9f37ceebf27c8a3c17b5ea3bb80e85",
      "dataset_plan_signature_hash": "1212121212121212121212121212121212121212121212121212121212121212",
      "registration_payload_hash": "71f8a7253a37bf8a49db549bf3c789b91d92c4d95029733a717358b87c3b1cfe",
      "registration_signature_hash": "1313131313131313131313131313131313131313131313131313131313131313",
      "registered_at": "2026-07-12T23:30:00Z",
      "of_search_plan_hash": "99937c29ae83d6548c732c5890d240e3e12aaa02b45b9555d746421a754d2b24",
      "of_search_plan_signed_at": "2026-07-12T23:05:00Z",
      "of_search_plan_signature_hash": "1414141414141414141414141414141414141414141414141414141414141414",
      "price_action_schema_hash": "d2305132fb4bfc4752bc1f5b889ee5ecb4344e0dbdafb1b744a5612e3577df63",
      "price_action_config_hash": "69f9f2c78c7079b1eefa5a20b88aafdf9d7bda2b50ff4b800d4e4629dceaa9d5",
      "price_action_signed_at": "2026-07-12T22:50:00Z",
      "price_action_signature_hash": "1515151515151515151515151515151515151515151515151515151515151515",
      "quality_profile_hash": "48034cde52174a109868e05a87922e6614b3f63ec699697e399949a6c0314c35",
      "collector_release_manifest_hash": "1010101010101010101010101010101010101010101010101010101010101010",
      "universe_config_hash": "1111111111111111111111111111111111111111111111111111111111111111"
    },
    "t0_inclusive": "2026-07-13T00:00:00Z",
    "t1_exclusive": "2026-07-16T00:00:00Z",
    "collector": {
      "release_id": "collector-2026.07.13-rc1",
      "collector_release_manifest_hash": "1010101010101010101010101010101010101010101010101010101010101010",
      "universe_config_hash": "1111111111111111111111111111111111111111111111111111111111111111",
      "git_commit": "1111111111111111111111111111111111111111",
      "image_manifest_hash": "2222222222222222222222222222222222222222222222222222222222222222",
      "config_manifest_hash": "3333333333333333333333333333333333333333333333333333333333333333",
      "schema_bundle_hash": "4444444444444444444444444444444444444444444444444444444444444444"
    },
    "data_roots": {
      "full_market_lightweight_root": "5555555555555555555555555555555555555555555555555555555555555555",
      "universe_snapshot_root": "6666666666666666666666666666666666666666666666666666666666666666",
      "l2_root": "7777777777777777777777777777777777777777777777777777777777777777",
      "daily_manifest_root": "8888888888888888888888888888888888888888888888888888888888888888"
    },
    "data_quality": {
      "status": "QUALIFIED",
      "rules_hash": "9999999999999999999999999999999999999999999999999999999999999999",
      "report_hash": "aaaaaaaaaaaaaaaaaaaaaaaaaaaaaaaaaaaaaaaaaaaaaaaaaaaaaaaaaaaaaaaa",
      "failed_reason_codes": []
    },
    "remote_verification": {
      "all_objects_remote_verified": true,
      "receipt_root_hash": "bbbbbbbbbbbbbbbbbbbbbbbbbbbbbbbbbbbbbbbbbbbbbbbbbbbbbbbbbbbbbbbb"
    },
    "project_seal_hash": "cccccccccccccccccccccccccccccccccccccccccccccccccccccccccccccccc",
    "created_at": "2026-07-16T01:00:00Z"
  },
  "signature": {
    "algorithm": "Ed25519",
    "key_id": "calibration-dataset-approver-2026",
    "value_base64": "AAAAAAAAAAAAAAAAAAAAAAAAAAAAAAAAAAAAAAAAAAAAAAAAAAAAAAAAAAAAAAAAAAAAAAAAAAAAAAAAAAAAAA==",
    "signed_at": "2026-07-16T01:05:00Z"
  }
}
